{
  "scenarioId": "default",
  "name": "自由探索",
  "description": "空白实验区，所有参数从默认值开始",
  "version": "1.0",
  "mode": "motion",
  "initialParams": {
    "mass": 50,
    "position": 0,
    "velocity": 0,
    "appliedForce": 0,
    "frictionCoeff": 0
  },
  "objects": [
    {
      "id": "box_10",
      "label": "小箱 (10kg)",
      "mass": 10,
      "icon": "inventory_2"
    },
    {
      "id": "box_20",
      "label": "中箱 (20kg)",
      "mass": 20,
      "icon": "inventory_2"
    },
    {
      "id": "box_50",
      "label": "大箱 (50kg)",
      "mass": 50,
      "icon": "warehouse"
    },
    {
      "id": "crate_100",
      "label": "货箱 (100kg)",
      "mass": 100,
      "icon": "cases"
    }
  ],
  "successCriteria": [
    {
      "id": "sc-1",
      "type": "speedReached",
      "description": "使物体加速到 5 m/s",
      "params": {
        "minSpeed": 5
      }
    },
    {
      "id": "sc-2",
      "type": "positionReached",
      "description": "将物体推到 20 m 位置",
      "params": {
        "minPosition": 20
      }
    }
  ],
  "hints": [
    {
      "trigger": "speed < 1",
      "message": "物体还没动起来！试试增加施加力"
    },
    {
      "trigger": "always",
      "message": "拖拽箱子到物体上增加质量，推动滑块施加力"
    }
  ]
}