{
  "scenarioId": "acceleration-explore",
  "name": "加速度测量",
  "description": "加速度模式 · 实时显示加速度计 · 改变质量和施加力观测 a=F/m 关系",
  "version": "1.0",
  "mode": "acceleration",
  "initialParams": {
    "mass": 50,
    "position": 0,
    "velocity": 0,
    "appliedForce": 200,
    "frictionCoeff": 0.25,
    "showAccelerometer": true
  },
  "objects": [
    {
      "id": "box_10",
      "label": "小箱 (10kg)",
      "mass": 10,
      "icon": "inventory_2"
    },
    {
      "id": "box_20",
      "label": "中箱 (20kg)",
      "mass": 20,
      "icon": "inventory_2"
    },
    {
      "id": "box_50",
      "label": "大箱 (50kg)",
      "mass": 50,
      "icon": "warehouse"
    },
    {
      "id": "crate_100",
      "label": "货箱 (100kg)",
      "mass": 100,
      "icon": "cases"
    }
  ],
  "successCriteria": [
    {
      "id": "sc-1",
      "type": "speedReached",
      "description": "使物体加速到 8 m/s 并观察加速度计读数",
      "params": {
        "minSpeed": 8
      }
    }
  ],
  "constraints": [
    {
      "id": "c1",
      "type": "maxSpeed",
      "description": "最大速度不超过 40 m/s",
      "params": {
        "maxSpeed": 40
      }
    },
    {
      "id": "c2",
      "type": "maxObjects",
      "description": "最多堆叠 3 个物体",
      "params": {
        "maxObjects": 3
      }
    }
  ],
  "hints": [
    {
      "trigger": "always",
      "message": "观察加速度计读数 · 验证 a = F/m · 改变质量或力看加速度如何变化"
    }
  ]
}